pub_date,link_to_book/_text,link_to_book,author,publisher
13/02/2012,Chapeau Bonheur,http://www.decitre.fr/livres/chapeau-bonheur-9782917871201.html,"Clotilde Bernos, Sabine Cazassus",Planète rêvée
13/02/2012,Nelly & César Le trésor caché,http://www.decitre.fr/livres/nelly-cesar-le-tresor-cache-9789031728770.html,Ingrid Godon,Averbode
13/02/2012,"Collage fun !. Crée les plus beaux panoramas à l'aide des pochoirs, des autollants et des pages à motifs",http://www.decitre.fr/livres/collage-fun-cree-les-plus-beaux-panoramas-a-l-aide-des-pochoirs-des-autollants-et-des-pages-a-motifs-edition-bilingue-francais-neerlandais-9789044731880.html,Frieda Van Raevels,Chantecler
13/02/2012,Super auto color,http://www.decitre.fr/livres/super-auto-color-9789044732382.html,Chantecler,Chantecler
13/02/2012,Ma belle maison. Coloriage,http://www.decitre.fr/livres/ma-belle-maison-9782803455256.html,Katy Jackson,Chantecler
13/02/2012,Super mandala coloring,http://www.decitre.fr/livres/super-mandala-coloring-9789044732320.html,Chantecler,Chantecler
13/02/2012,Pars à la découverte de la nature,http://www.decitre.fr/livres/pars-a-la-decouverte-de-la-nature-9782803454563.html,Angelika Lenz,Chantecler
10/02/2012,"Histoires de chevaux, de poneys et licornes. Jeunes lecteurs CP-CE",http://www.decitre.fr/livres/histoires-de-chevaux-de-poneys-et-licornes-9782215117162.html,"Christelle Chatel, Annick Gabillet",Fleurus
10/02/2012,Machine à lettres,http://www.decitre.fr/livres/machine-a-lettres-9782352891345.html,Julien Magnani,MeMo (Editions)
10/02/2012,Pas de ciel sans oiseaux,http://www.decitre.fr/livres/pas-de-ciel-sans-oiseaux-9782740428436.html,Rémi Courgeon,Mango Jeunesse
10/02/2012,Le dauphin et la baleine,http://www.decitre.fr/livres/le-dauphin-et-la-baleine-9782740429242.html,"Dreaming Green, Su-bok Choi",Mango Jeunesse
10/02/2012,Le crocodile,http://www.decitre.fr/livres/le-crocodile-9782740429259.html,"Dreaming Green, Young-ran Kim",Mango Jeunesse
10/02/2012,La princesse vient à quatre heures,http://www.decitre.fr/livres/la-princesse-vient-a-quatre-heures-9782889081127.html,"Wolfdietrich Schnurre, Rotraut Susanne Berner",La joie de lire
10/02/2012,Le camion-poubelle,http://www.decitre.fr/livres/le-camion-poubelle-9782889081141.html,Max Estes,La joie de lire
10/02/2012,1000 Stickers et Activités sur les animaux,http://www.decitre.fr/livres/1000-stickers-et-activites-sur-les-animaux-9781445459622.html,Parragon,Parragon
10/02/2012,L'escargot,http://www.decitre.fr/livres/l-escargot-9782740429211.html,"Dreaming Green, Jin-Mi Jeong",Mango Jeunesse
10/02/2012,Le livre des filles à dessiner et à colorier (aussi autorisé aux garçons !),http://www.decitre.fr/livres/le-livre-des-filles-a-dessiner-et-a-colorier-aussi-autorise-aux-garcons-9782840066644.html,"Beth Gunnell, Katy Jackson, Nellie Ryan",Mila éditions
10/02/2012,Les chiffres,http://www.decitre.fr/livres/les-chiffres-9782215115205.html,"Jacques Beaumont, Mélusine Allirol",Fleurus
10/02/2012,Le papillon,http://www.decitre.fr/livres/le-papillon-9782740429228.html,"Dreaming Green, Hee-jeong Yi",Mango Jeunesse
10/02/2012,L'abeille,http://www.decitre.fr/livres/l-abeille-9782740429235.html,"Dreaming Green, Su-bok Choi",Mango Jeunesse
10/02/2012,Mon coffre à jouets. 1 livre et 9 cubes puzzle,http://www.decitre.fr/livres/mon-coffre-a-jouets-9782740429266.html,Julie Fletcher,Mango Jeunesse
10/02/2012,L'âne blanc avec 1 CD audio,http://www.decitre.fr/livres/l-ane-blanc-9782918911227.html,"Henri Dès, Cécile Gambini",Braques (Les Editions des)
10/02/2012,Toi et moi. 1 livre et 9 cubes puzzle,http://www.decitre.fr/livres/toi-et-moi-9782740429273.html,Ana Martin Larrañaga,Mango Jeunesse
10/02/2012,Les héros du 18 Tome 1 Un mystérieux incendiaire,http://www.decitre.fr/livres/les-heros-du-18-tome-1-un-mysterieux-incendiaire-9782081270015.html,Anne-Marie Desplat-Duc,Flammarion
10/02/2012,Les héros du 18 Tome 2 Prisonniers des flammes,http://www.decitre.fr/livres/les-heros-du-18-tome-2-prisonniers-des-flammes-9782081270022.html,Anne-Marie Desplat-Duc,Flammarion
10/02/2012,Les Aventurêves Tome 1 L'union fait la force,http://www.decitre.fr/livres/les-aventureves-tome-1-l-union-fait-la-force-9782215107736.html,Carole Bonnet,Fleurus
10/02/2012,L'alphabet,http://www.decitre.fr/livres/l-alphabet-9782215114406.html,"Jacques Beaumont, Mélusine Allirol","[""Fleurus"", ""Jeunesse""]"
10/02/2012,La ferme,http://www.decitre.fr/livres/la-ferme-9782215114413.html,"Jacques Beaumont, Mélusine Allirol",Fleurus
10/02/2012,Sacré dimanche !,http://www.decitre.fr/livres/sacre-dimanche-9782215114437.html,Christine Sagnier,Fleurus
10/02/2012,Tout ça... pour ça !,http://www.decitre.fr/livres/tout-ca-9782215114444.html,"Christine Sagnier, Caroline Hesnard",Fleurus
10/02/2012,Les saisons,http://www.decitre.fr/livres/les-saisons-9782215117452.html,"Juliette Parachini-Deny, Virginie Martins-B",Fleurus
10/02/2012,La journée,http://www.decitre.fr/livres/la-journee-9782215117469.html,"Juliette Parachini-Deny, Elen Lescoat",Fleurus
10/02/2012,Pourquoi Moi ?,http://www.decitre.fr/livres/pourquoi-moi-9782362310362.html,Kimberly Pauley,"[""Castelmore"", ""E-book""]"
10/02/2012,Apocalypse Zombie,http://www.decitre.fr/livres/apocalypse-zombie-9782362310423.html,Jonathan Maberry,"[""Castelmore"", ""E-book""]"
10/02/2012,Léonard Tome 42 Le génie des grandeurs,http://www.decitre.fr/livres/leonard-tome-42-le-genie-des-grandeurs-9782803629602.html,"Turk, Bob De Groot","[""Lombard"", ""E-book""]"
10/02/2012,Kû et Kaï. 2 vrais héros,http://www.decitre.fr/livres/ku-et-kai-9782915517736.html,326,IMHO Editions
10/02/2012,Pays des morts Tome 1 Les Landes d'Amevignes,http://www.decitre.fr/livres/pays-des-morts-tome-1-les-landes-d-amevignes-9782362310409.html,Anna Kendall,Castelmore
10/02/2012,Le chat,http://www.decitre.fr/livres/le-chat-9782740429204.html,"Choroki, Ji-yeon Lim",Mango Jeunesse
10/02/2012,Les Romains,http://www.decitre.fr/livres/les-romains-9782215106654.html,"Jack Beaumont, Sylvie Deraime",Fleurus
10/02/2012,Les Aventurêves Tome 2 Qui s'y frotte s'y pique,http://www.decitre.fr/livres/les-aventureves-tome-2-qui-s-y-frotte-s-y-pique-9782215107743.html,Carole Bonnet,Fleurus
10/02/2012,La mer,http://www.decitre.fr/livres/la-mer-9782215114390.html,"Jacques Beaumont, Mélusine Allirol",Fleurus
10/02/2012,Les jouets,http://www.decitre.fr/livres/les-jouets-9782215114543.html,"Emilie Beaumont, Nathalie Bélineau, Christelle Mekdjian",Fleurus
10/02/2012,Les couleurs,http://www.decitre.fr/livres/les-couleurs-9782215117476.html,"Juliette Parachini-Deny, Elen Lescoat",Fleurus
10/02/2012,Les animaux de la ferme,http://www.decitre.fr/livres/les-animaux-de-la-ferme-9782215117483.html,"Juliette Parachini-Deny, Maëlle C",Fleurus
10/02/2012,Lili est harcelée à l'école,http://www.decitre.fr/livres/lili-est-harcelee-a-l-ecole-9782884806206.html,"Serge Bloch, Dominique de Saint Mars",Calligram
10/02/2012,La disparition,http://www.decitre.fr/livres/la-disparition-9782352891352.html,Dominique Frasson-Cochet,MeMo (Editions)
09/02/2012,Châteaux et chevaliers. Cahier de dessin,http://www.decitre.fr/livres/chateaux-et-chevaliers-9781409539988.html,Candice Whatmore,Usborne Publishing
09/02/2012,L'hélicoptère. Avec un jouet à friction et 4 pistes,http://www.decitre.fr/livres/l-helicoptere-9781409540007.html,"Fiona Watt, Gabriele Antonini",Usborne Publishing
09/02/2012,La Bible illustrée,http://www.decitre.fr/livres/la-bible-illustree-9781409540045.html,Heather Amery,Usborne Publishing
09/02/2012,Au lit !,http://www.decitre.fr/livres/au-lit-9781409540069.html,Rosalinde Bonnet,Usborne Publishing
09/02/2012,Minucette et la tortue géante,http://www.decitre.fr/livres/minucette-et-la-tortue-geante-9782070643165.html,Alice Bohl,Gallimard Jeunesse Giboulées
09/02/2012,"La vie, c'est quoi ?",http://www.decitre.fr/livres/la-vie-c-est-quoi-9782092535394.html,Oscar Brenifier,Nathan
09/02/2012,Qui se cache sous ces friandises,http://www.decitre.fr/livres/qui-se-cache-sous-ces-friandises-9782354131555.html,Yusuke Yonezu,Minedition
09/02/2012,Le joueur de flûte de Hamelin,http://www.decitre.fr/livres/le-joueur-de-flute-de-hamelin-9782354131579.html,"Lisbeth Zwerger, Jakob et Wilhelm Grimm",Minedition
09/02/2012,"Toc toc toc, Qui es-tu?",http://www.decitre.fr/livres/toc-toc-toc-qui-es-tu-9782354502171.html,"Nathalie Dujardin, Marie Paruit",Coédition Amaterra/Nouvel Angle
09/02/2012,Comment parler de Niki St Phalle aux enfants,http://www.decitre.fr/livres/comment-parler-de-niki-st-phalle-aux-enfants-9782360800469.html,Anne Cortey,Baron perché (Le)
09/02/2012,Cuisiner nature. Recettes et activités pour manger autrement,http://www.decitre.fr/livres/cuisiner-nature-9782708881341.html,"Elise Bancon, Christelle Kasparian, Elisabeth Stehly",Presses d'Ile de France
09/02/2012,Dans la ville,http://www.decitre.fr/livres/dans-la-ville-9782747038812.html,Britta Teckentrup,Bayard Jeunesse
09/02/2012,Les sept sacrements,http://www.decitre.fr/livres/les-sept-sacrements-9782747039277.html,Rosamée d' Andlau,Bayard Jeunesse
09/02/2012,"Les Chercheurs de Dieu Tome 2 L'abbé Pierre, Pauline Jaricot, Xavier De Nicolo",http://www.decitre.fr/livres/les-chercheurs-de-dieu-tome-2-l-abbe-pierre-pauline-jaricot-xavier-de-nicolo-9782747040044.html,"Jean-Louis Fonteneau, Thierry Lescuyer, Marie-Noëlle Pichard",Bayard Jeunesse
09/02/2012,La petite terre de papier,http://www.decitre.fr/livres/la-petite-terre-de-papier-9782874261558.html,"Agnès de Lestrade, Charlotte Cottereau",Alice Jeunesse
09/02/2012,Et tu es né...,http://www.decitre.fr/livres/et-tu-es-ne-9782844552174.html,"Valérie Weishar-Giuliani, Cécile Vangout",Elan vert (L')
09/02/2012,Lulu-Grenadine aime la piscine,http://www.decitre.fr/livres/lulu-grenadine-aime-la-piscine-9782092538777.html,"Laurence Gillot, Lucie Durbiano",Nathan
09/02/2012,"Les Chercheurs de Dieu Tome 12 Saint Pierre, Saint Etienne",http://www.decitre.fr/livres/les-chercheurs-de-dieu-tome-12-saint-pierre-saint-etienne-9782747039925.html,"Benoît Marchon, Claude Millet, Denise Millet, Louis Alloing",Bayard Jeunesse
09/02/2012,"Les Chercheurs de Dieu Tome 9 Jeanne d'Arc, Bartolomé de Las Casas",http://www.decitre.fr/livres/les-chercheurs-de-dieu-tome-9-jeanne-d-arc-bartolome-de-las-casas-9782747039918.html,"Jean-Louis Fonteneau, Philippe Remy, Etienne Jung, Gaëtan Evrard",Bayard Jeunesse
09/02/2012,On fait comment pour changer le monde ?. Les grandes questions sur le monde éclairées par un regard chrétien,http://www.decitre.fr/livres/on-fait-comment-pour-changer-le-monde-les-grandes-questions-sur-le-monde-eclairees-par-un-regard-chretien-9782747039314.html,Filotéo,Bayard Jeunesse
09/02/2012,Loulou de Montmartre Tome 19 Les secrets du Moulin Rouge,http://www.decitre.fr/livres/loulou-de-montmartre-tome-19-les-secrets-du-moulin-rouge-9782747037495.html,Michel Leydier,Bayard
09/02/2012,1001 choses de monstre à trouver,http://www.decitre.fr/livres/1001-choses-de-monstre-a-trouver-9781409540038.html,Gillian Doherty,Usborne
09/02/2012,"Les Chercheurs de Dieu Tome 18 Le curé d'Ars, Elisabeth de Hongrie, Le père Ceyrac",http://www.decitre.fr/livres/les-chercheurs-de-dieu-tome-18-le-cure-d-ars-elisabeth-de-hongrie-le-pere-ceyrac-9782747039895.html,"Benoît Marchon, Carole Xénard, Karine Bernadou, Jeff Pourquié",Bayard Jeunesse
09/02/2012,Dessins et coloriages. Les motifs,http://www.decitre.fr/livres/dessins-et-coloriages-9781409539995.html,"Lizzie Barber, Keith Furnival, Ruth Russell, Kirsteen Rogers",Usborne
09/02/2012,Arthur Ier et le trône à trois pieds,http://www.decitre.fr/livres/arthur-ier-et-le-trone-a-trois-pieds-9782354881498.html,Eric Battut,Gulf Stream
09/02/2012,Le livre des possibles,http://www.decitre.fr/livres/le-livre-des-possibles-9782732448923.html,Alain Korkos,De La Martinière Jeunesse
09/02/2012,"Le baptême, c'est quoi ?",http://www.decitre.fr/livres/le-bapteme-c-est-quoi-9782747040020.html,Elodie Maurot,Bayard Jeunesse
09/02/2012,Qui suis-je ?,http://www.decitre.fr/livres/qui-suis-je-9782021068580.html,Alain Crozon,Seuil Jeunesse
09/02/2012,Qui se cache sous les fleurs ?,http://www.decitre.fr/livres/qui-se-cache-sous-les-fleurs-9782354131548.html,Yusuke Yonezu,Minedition
09/02/2012,C'est quoi être amoureux ?,http://www.decitre.fr/livres/c-est-quoi-etre-amoureux-9782747036443.html,"Serge Hefez, Florence Lotthé-Glaser, Emmanuelle Teyras",Bayard Jeunesse
09/02/2012,L'hstoire de la vieille bique et de ses sept biquets,http://www.decitre.fr/livres/l-hstoire-de-la-vieille-bique-et-de-ses-sept-biquets-9782871427735.html,Tony Ross,Mijade
09/02/2012,Les aventures fantastiques de Sacré-Coeur Le vampire de la tour Eiffel,http://www.decitre.fr/livres/les-aventures-fantastiques-de-sacre-coeur-le-vampire-de-la-tour-eiffel-9782353480364.html,"Amélie Sarn, Laurent Audouin",Le Petit Lézard
09/02/2012,"Meilleures ennemies Tome 1 Meilleures amies, pires ennemies",http://www.decitre.fr/livres/meilleures-ennemies-tome-1-meilleures-amies-pires-ennemies-9782749915371.html,Alexa Young,Michel Lafon
09/02/2012,Star Wars Les héros de la saga,http://www.decitre.fr/livres/star-wars-les-heros-de-la-saga-9782092538654.html,Simon Beecroft,Nathan
09/02/2012,"Dada N° 171, Février 2012 Tim Burton",http://www.decitre.fr/revues/dada-n-171-fevrier-2012-tim-burton-9782358800327.html,"Christian Nobial, Antoine Ullmann",Arola
09/02/2012,La science en s'amusant. Avec plus de 500 autocollants,http://www.decitre.fr/livres/la-science-en-s-amusant-9781409546344.html,"Leonie Pratt, Rebecca Gilpin",Usborne
09/02/2012,Viens t'amuser !,http://www.decitre.fr/livres/viens-t-amuser-9782070642939.html,Benji Davies,Gallimard jeunesse
09/02/2012,L'école,http://www.decitre.fr/livres/l-ecole-9782092537336.html,Thierry Courtin,Nathan
09/02/2012,Trois amies pour la vie,http://www.decitre.fr/livres/trois-amies-pour-la-vie-9782070628438.html,Ann Brashares,"[""Gallimard jeunesse"", ""Grand Format""]"
09/02/2012,La Team Tome 1 Gang of Paname,http://www.decitre.fr/livres/la-team-tome-1-gang-of-paname-9782070640652.html,Wassim,"[""Gallimard (Editions)"", ""E-book""]"
09/02/2012,Skully Fourbery Tome 4 Skully Fourbery n'est plus de ce monde,http://www.decitre.fr/livres/skully-fourbery-tome-4-skully-fourbery-n-est-plus-de-ce-monde-9782070644360.html,Derek Landy,"[""Gallimard-Jeunesse"", ""Poche""]"
09/02/2012,Samuel Chasse à l'ombre,http://www.decitre.fr/livres/samuel-chasse-a-l-ombre-9782092536582.html,"Thomas Ehretsmann, Hubert Ben Kemoun","[""Nathan"", ""E-book""]"
09/02/2012,Théodore et ses 13 fantômes Tome 2,http://www.decitre.fr/livres/theodore-et-ses-13-fantomes-tome-2-9782092537992.html,Claude Carré,"[""Nathan"", ""E-book""]"
09/02/2012,La trilogie de braises et de ronces Tome 1 La fille de braises et de ronces,http://www.decitre.fr/livres/la-trilogie-de-braises-et-de-ronces-tome-1-la-fille-de-braises-et-de-ronces-9782221127148.html,Rae Carson,"[""Robert Laffont"", ""E-book""]"
09/02/2012,Le chat botté de rouge,http://www.decitre.fr/livres/le-chat-botte-de-rouge-9782354131586.html,Ayano Imai,"[""Minedition"", ""Jeunesse""]"
09/02/2012,Bye bye crazy girl,http://www.decitre.fr/livres/bye-bye-crazy-girl-9782732448701.html,Joe Schreiber,"[""De La Martinière Jeunesse"", ""E-book""]"
09/02/2012,L'enfant aux pistolets,http://www.decitre.fr/livres/l-enfant-aux-pistolets-9782844552143.html,"Michel Séonnet, Bruno Pilorget","[""Elan vert (L')"", ""Jeunesse""]"
09/02/2012,Super Albert,http://www.decitre.fr/livres/super-albert-9782871427698.html,"Philippe Goossens, Thierry Robberecht","[""Mijade"", ""Jeunesse""]"
09/02/2012,"Papa, Maman, Anouk et moi",http://www.decitre.fr/livres/papa-maman-anouk-et-moi-9782871427780.html,Jérôme Ruillier,Mijade
09/02/2012,Papa-loup,http://www.decitre.fr/livres/papa-loup-9782871427827.html,Isabelle Carrier,"[""Mijade"", ""Jeunesse""]"
09/02/2012,Ma maman et moi,http://www.decitre.fr/livres/ma-maman-et-moi-9782873885915.html,Helen Exley,Exley (Editions)
09/02/2012,Skully Fourbery Tome 3 Skully Fourbery contre les Sans-Visage,http://www.decitre.fr/livres/skully-fourbery-tome-3-skully-fourbery-contre-les-sans-visage-9782070603190.html,Derek Landy,"[""Gallimard jeunesse"", ""Grand Format""]"
09/02/2012,60 expériences faciles et amusantes !,http://www.decitre.fr/livres/60-experiences-faciles-et-amusantes-9782092537459.html,Delphine Grinberg,Nathan
09/02/2012,Théodore et ses 13 fantômes Tome 1,http://www.decitre.fr/livres/theodore-et-ses-13-fantomes-tome-1-9782092537985.html,Claude Carré,"[""Nathan"", ""E-book""]"
09/02/2012,"Les Chercheurs de Dieu Tome 1 Mère Teresa, Don Bosco, Matteo Ricci",http://www.decitre.fr/livres/les-chercheurs-de-dieu-tome-1-mere-teresa-don-bosco-matteo-ricci-9782747039970.html,"Marie-Noëlle Pichard, Pierre Dhombre, Isabelle de Wazières",Bayard Jeunesse
09/02/2012,Les déguisements,http://www.decitre.fr/livres/les-deguisements-9781409540014.html,Emily Bone,Usborne Publishing
09/02/2012,Un ticket pour la Lune,http://www.decitre.fr/livres/un-ticket-pour-la-lune-9782070627998.html,Frank Cottrell Boyce,"[""Gallimard-Jeunesse"", ""Grand Format""]"
09/02/2012,A la ferme,http://www.decitre.fr/livres/a-la-ferme-9782070642922.html,Benji Davies,Gallimard-Jeunesse
09/02/2012,Les aventures de Tim et Gruk Tome 1 Un chien nommé Gruk,http://www.decitre.fr/livres/les-aventures-de-tim-et-gruk-tome-1-un-chien-nomme-gruk-9782070643820.html,Josh Lacey,Gallimard (Editions)
09/02/2012,Les filles au chocolat Tome 2 Coeur guimauve,http://www.decitre.fr/livres/les-filles-au-chocolat-tome-2-coeur-guimauve-9782092535349.html,Cathy Cassidy,"[""Nathan"", ""Poche""]"
09/02/2012,"La liberté, c'est quoi ?",http://www.decitre.fr/livres/la-liberte-c-est-quoi-9782092535400.html,"Oscar Brenifier, Frédéric Rébéna",Nathan
09/02/2012,T'choupi dans le jardin,http://www.decitre.fr/livres/t-choupi-dans-le-jardin-9782092537183.html,Thierry Courtin,Nathan
09/02/2012,T'choupi au zoo,http://www.decitre.fr/livres/t-choupi-au-zoo-9782092537220.html,Thierry Courtin,Nathan
09/02/2012,T'choupi dans la nuit,http://www.decitre.fr/livres/t-choupi-dans-la-nuit-9782092537237.html,Thierry Courtin,Nathan
09/02/2012,T'choupi au marché,http://www.decitre.fr/livres/t-choupi-au-marche-9782092537251.html,Thierry Courtin,Nathan
09/02/2012,T'choupi au square,http://www.decitre.fr/livres/t-choupi-au-square-9782092537268.html,Thierry Courtin,Nathan
09/02/2012,T'choupi et les transports,http://www.decitre.fr/livres/t-choupi-et-les-transports-9782092537275.html,Thierry Courtin,Nathan
09/02/2012,Les petites bêtes,http://www.decitre.fr/livres/les-petites-betes-9782092537350.html,Thierry Courtin,Nathan
09/02/2012,Lulu-Grenadine est amoureuse,http://www.decitre.fr/livres/lulu-grenadine-est-amoureuse-9782092539705.html,"Laurence Gillot, Lucie Durbiano",Nathan
09/02/2012,Inazuma Eleven Tome 6,http://www.decitre.fr/livres/inazuma-eleven-tome-6-9782351427019.html,Tenya Yabuno,Kurokawa
09/02/2012,Comment parler d'Edgar Degas aux enfants,http://www.decitre.fr/livres/comment-parler-d-edgar-degas-aux-enfants-9782360800452.html,Christophe Hardy,Baron perché (Le)
09/02/2012,Le loup qui ne voulait plus marcher,http://www.decitre.fr/livres/le-loup-qui-ne-voulait-plus-marcher-9782733819029.html,"Orianne Lallemand, Eléonore Thuillier","[""Auzou (Editions)"", ""Jeunesse""]"
09/02/2012,Le loup qui cherchait une amoureuse,http://www.decitre.fr/livres/le-loup-qui-cherchait-une-amoureuse-9782733819685.html,"Orianne Lallemand, Eléonore Thuillier","[""Auzou (Editions)"", ""Jeunesse""]"
09/02/2012,Mon papa et Moi,http://www.decitre.fr/livres/mon-papa-et-moi-9782873885922.html,Helen Exley,Exley (Editions)
09/02/2012,Ma mamie et moi,http://www.decitre.fr/livres/ma-mamie-et-moi-9782873885939.html,Helen Exley,Exley (Editions)
09/02/2012,Mon papy et moi,http://www.decitre.fr/livres/mon-papy-et-moi-9782873885946.html,"Helen Exley, Jane Massey",Exley (Editions)
09/02/2012,Le chat botté,http://www.decitre.fr/livres/le-chat-botte-9782352830658.html,Dino Battaglia,"[""Mosquito"", ""E-book""]"
09/02/2012,Noé face au déluge,http://www.decitre.fr/livres/noe-face-au-deluge-9782092538067.html,Flore Talamon,"[""Nathan"", ""E-book""]"
08/02/2012,Oui-Oui. Taxi colo,http://www.decitre.fr/livres/oui-oui-9782012270961.html,Hachette,Hachette Jeunesse
08/02/2012,Petit Lapin Blanc est très poli,http://www.decitre.fr/livres/petit-lapin-blanc-est-tres-poli-9782012273238.html,"Marie-France Floury, Fabienne Boisnard",Gautier Languereau
08/02/2012,Alanna Tome 2 L'épreuve,http://www.decitre.fr/livres/alanna-tome-2-l-epreuve-9782013223355.html,Tamora Pierce,Hachette
08/02/2012,Baleines. Un livre + une maquette 3D à construire,http://www.decitre.fr/livres/baleines-9782081258433.html,"Dee Costello, Helen Keith",Père Castor-Flammarion
08/02/2012,Agito Cosmos Tome 1 Aquaviva,http://www.decitre.fr/livres/agito-cosmos-tome-1-aquaviva-9782723484121.html,"Olivier Milhaud, Fabien Mense",Glénat
08/02/2012,Le Joueur de flûte avec 1 CD audio,http://www.decitre.fr/livres/le-joueur-de-flute-9782723488068.html,Atelier Philippe Harchy,Glénat
08/02/2012,Le Petit Prince Tome 5 La planète de l'astronomie,http://www.decitre.fr/livres/le-petit-prince-tome-5-la-planete-de-l-astronomie-9782723488242.html,"Guillaume Dorison, Diane Fayolle",Glénat
08/02/2012,Le Petit Prince Tome 6 La planète des Globus,http://www.decitre.fr/livres/le-petit-prince-tome-6-la-planete-des-globus-9782723488259.html,"Guillaume Dorison, Didier Poli, Diane Fayolle, Isa Python",Glénat
08/02/2012,Mon poney et moi Tome 2 Pauline et Prince,http://www.decitre.fr/livres/mon-poney-et-moi-tome-2-pauline-et-prince-9782745956279.html,Kelly McKain,Milan Jeunesse
08/02/2012,Winx Club Tome 6 Le Monstre du marais,http://www.decitre.fr/livres/winx-club-tome-6-le-monstre-du-marais-9782809423013.html,"Giorgio Pezzin, Michele Bizzi, Gige",Panini
08/02/2012,Mes premiers apprentissages avec Douki dès 2 ans. Ma journée,http://www.decitre.fr/livres/mes-premiers-apprentissages-avec-douki-des-2-ans-9782809646795.html,PlayBac,Play Bac
08/02/2012,Les animaux. Mes premiers apprentissages avec Douki,http://www.decitre.fr/livres/les-animaux-9782809646801.html,Virginie Chiodo,Play Bac
08/02/2012,Le grand trou américain,http://www.decitre.fr/livres/le-grand-trou-americain-9782812603082.html,Michel Galvin,Rouergue
08/02/2012,Cupidon Tome 22 Une copine pour Cupidon,http://www.decitre.fr/livres/cupidon-tome-22-une-copine-pour-cupidon-9782872655113.html,Malik,Joker Editions
08/02/2012,Toula. Une histoire d'adoption,http://www.decitre.fr/livres/toula-9782953804508.html,"Patricia Chalon, Alice Faroux",Enfance majuscule
08/02/2012,Dinosaures. 1 livre + 1 maquette 3D à construire,http://www.decitre.fr/livres/dinosaures-9782081258440.html,Helen Keith,Père Castor-Flammarion
08/02/2012,La lampe des Jumeaux,http://www.decitre.fr/livres/la-lampe-des-jumeaux-9782940456703.html,Bénédicte Carboneill,Limonade (Editions)
08/02/2012,Theferless,http://www.decitre.fr/livres/theferless-9782203049284.html,Anne Herbauts,Casterman
08/02/2012,Animalia. Voyage animé au pays des animaux,http://www.decitre.fr/livres/animalia-9782745953520.html,"Arnaud Roi, Hélène Rajcak",Milan (Editions)
08/02/2012,Le temps de la vengeance,http://www.decitre.fr/livres/le-temps-de-la-vengeance-9782702434956.html,Cayla Kluver,Masque (Editions du)
08/02/2012,Street football,http://www.decitre.fr/livres/street-football-9782745954268.html,"Isabel Thomas, Sarah Eason",Milan (Editions)
08/02/2012,La dictature et la démocratie,http://www.decitre.fr/livres/la-dictature-et-la-democratie-9782745955104.html,"Brigitte Labbé, Pierre-François Dupont-Beurier",Milan (Editions)
08/02/2012,BMX freestyle,http://www.decitre.fr/livres/bmx-freestyle-9782745956842.html,Isabel Thomas,Milan (Editions)
08/02/2012,Free running,http://www.decitre.fr/livres/free-running-9782745956859.html,"Paul Mason, Sarah Eason",Milan (Editions)
08/02/2012,Skate-board & co,http://www.decitre.fr/livres/skate-board-co-9782745956866.html,Isabel Thomas,Milan (Editions)
08/02/2012,Le Bal des Elfes avec 1 CD audio,http://www.decitre.fr/livres/le-bal-des-elfes-9782723488075.html,"Atelier Philippe Harchy, Wilhelm Grimm, Jakob Grimm",Glénat
08/02/2012,Goupil le rusé renard avec 1 CD audio,http://www.decitre.fr/livres/goupil-le-ruse-renard-9782723488099.html,Atelier Philippe Harchy,Glénat
08/02/2012,"Belle, intelligente et courageuse Tome 1 Agathe et les miroirs menteurs",http://www.decitre.fr/livres/belle-intelligente-et-courageuse-tome-1-agathe-et-les-miroirs-menteurs-9782012027725.html,Beatrice Masini,Hachette Jeunesse
08/02/2012,Petit Lapin Blanc fait du camping,http://www.decitre.fr/livres/petit-lapin-blanc-fait-du-camping-9782012273214.html,"Marie-France Floury, Fabienne Boisnard",Gautier Languereau
08/02/2012,Petit Lapin Blanc joue à cache-cache,http://www.decitre.fr/livres/petit-lapin-blanc-joue-a-cache-cache-9782012273221.html,"Marie-France Floury, Fabienne Boisnard",Gautier Languereau
08/02/2012,"Bonjour, bonsoir",http://www.decitre.fr/livres/bonjour-bonsoir-9782278065486.html,Véronique Mazière,Didier Jeunesse
08/02/2012,Le piano,http://www.decitre.fr/livres/le-piano-9782278067589.html,Marion Duval,Didier Jeunesse
08/02/2012,Mes premières énigmes. 4-6 ans,http://www.decitre.fr/livres/mes-premieres-enigmes-9782809646818.html,PlayBac,Play Bac
08/02/2012,Paola Crusoé Tome 1 Naufragée,http://www.decitre.fr/livres/paola-crusoe-tome-1-naufragee-9782723480895.html,Mathilde Domecq,Glénat
08/02/2012,Récolte la tempête,http://www.decitre.fr/livres/recolte-la-tempete-9782745956231.html,Jean-Albert Mazaud,Milan (Editions)
08/02/2012,Dipoula l'albinos Tome 3 La vie gabonaise,http://www.decitre.fr/livres/dipoula-l-albinos-tome-3-la-vie-gabonaise-9782888904427.html,"Sti, Pahé, Louis-Bertrand Devaud",Paquet
08/02/2012,Petit Lapin Blanc fait la cuisine,http://www.decitre.fr/livres/petit-lapin-blanc-fait-la-cuisine-9782012273207.html,"Marie-France Floury, Fabienne Boisnard","[""Gautier Languereau"", ""Jeunesse""]"
