pub_date,link_to_book/_text,link_to_book,author,publisher
05/10/2011,Aimata et le secret des tambours. Un conte pour découvrir les tamboursde Tahiti avec 1 CD audio,http://www.decitre.fr/livres/aimata-et-le-secret-des-tambours-9782330000707.html,Laure Urgin,Actes Sud Junior
05/10/2011,Les transports,http://www.decitre.fr/livres/les-transports-9782745952288.html,Marion Billet,Milan (Editions)
05/10/2011,Le temps qu'il fait,http://www.decitre.fr/livres/le-temps-qu-il-fait-9782745952295.html,Marion Billet,Milan (Editions)
05/10/2011,52 enquêtes pour petits détectives,http://www.decitre.fr/livres/52-enquetes-pour-petits-detectives-9782351553909.html,Niccolo Barbiero,Editions 365
05/10/2011,Téa Sisters Tome 12 L'émeraude du prince indien,http://www.decitre.fr/livres/tea-sisters-tome-12-l-emeraude-du-prince-indien-9782226230997.html,Téa Stilton,Albin Michel Jeunesse
05/10/2011,Coffret Princesses. 6 histoires et 6 coloriages,http://www.decitre.fr/livres/coffret-princesses-9782014639865.html,Disney,Hachette Jeunesse
05/10/2011,Le bestiaire de l'Olympe,http://www.decitre.fr/livres/le-bestiaire-de-l-olympe-9782745953421.html,"Anne Jonas, Nancy Peña",Milan (Editions)
05/10/2011,L'Etang aux libellules,http://www.decitre.fr/livres/l-etang-aux-libellules-9782226209375.html,Eva Ibbotson,Albin Michel (Editions)
05/10/2011,La dynastie Donald Duck Tome 4 Les mystères de l'Atlantide et autres histoires,http://www.decitre.fr/livres/la-dynastie-donald-duck-tome-4-les-mysteres-de-l-atlantide-et-autres-histoires-9782723483148.html,Carl Barks,Glénat
05/10/2011,Le voyage de Zadim avec 2 CD audio,http://www.decitre.fr/livres/le-voyage-de-zadim-9782745953315.html,"Landy Andriamboavonjy, Charlotte Gastaut",Milan (Editions)
05/10/2011,Les Simpson Tome 16 Wingding,http://www.decitre.fr/livres/les-simpson-tome-16-wingding-9782874428159.html,"Matt Groening, Morrison",Jungle
05/10/2011,La Belle au Bois Dormant avec 1 CD audio,http://www.decitre.fr/livres/la-belle-au-bois-dormant-9782013936057.html,"Elodie Fondacci, Eric Puybaret",Gautier Languereau
05/10/2011,Le goût de la tomate,http://www.decitre.fr/livres/le-gout-de-la-tomate-9782364740211.html,Christophe Léon,Thierry Magnier
05/10/2011,Pomelo et les couleurs,http://www.decitre.fr/livres/pomelo-et-les-couleurs-9782226230973.html,"Ramona Badescu, Benjamin Chaud",Albin Michel Jeunesse
05/10/2011,Le Corps humain,http://www.decitre.fr/livres/le-corps-humain-9782035869951.html,Linda Calabresi,Larousse Jeunesse
05/10/2011,Monsieur et Madame Neige avec 1 CD audio,http://www.decitre.fr/livres/monsieur-et-madame-neige-9782330000295.html,Syrano,Actes Sud Junior
05/10/2011,Des animaux en (n)ombre,http://www.decitre.fr/livres/des-animaux-en-n-ombre-9782330000486.html,Dimitri Delmas,Actes Sud Junior
05/10/2011,Le Rossignol chante la nuit,http://www.decitre.fr/livres/le-rossignol-chante-la-nuit-9782364740051.html,"Colette Berthès, Rachid Koraïchi",Thierry Magnier
05/10/2011,Gaspard le léopard Tome 7 Pousse toi de là,http://www.decitre.fr/livres/gaspard-le-leopard-tome-7-pousse-toi-de-la-9782745953841.html,"Gérard Moncomble, Eric Gasté",Milan (Editions)
05/10/2011,L'encyclopédie Ushuaïa Junior,http://www.decitre.fr/livres/l-encyclopedie-ushuaia-junior-9782011604071.html,"Penelope Arlon, Caroline Bingham, Ben Morgan, Eric Mathivet",Hachette Education
05/10/2011,Le dernier hiver,http://www.decitre.fr/livres/le-dernier-hiver-9782012023512.html,Jean-Luc Marcastel,Hachette Jeunesse
05/10/2011,Emilie Jolie,http://www.decitre.fr/livres/emilie-jolie-9782012023604.html,Christine Féret-Fleury,Hachette
05/10/2011,Astérix Tome 13 Astérix et le chaudron,http://www.decitre.fr/livres/asterix-tome-13-asterix-et-le-chaudron-9782012101807.html,"Albert Uderzo, René Goscinny",Hachette
05/10/2011,Emilie Jolie. Le conte musical avec 1 CD audio,http://www.decitre.fr/livres/emilie-jolie-9782012272804.html,"Francis Nielsen, Philippe Chatel",Hachette Jeunesse
05/10/2011,Le Carnaval des Animaux avec 1 CD audio,http://www.decitre.fr/livres/le-carnaval-des-animaux-9782013936064.html,"Elodie Fondacci, David Merveille",Gautier Languereau
05/10/2011,Le monde,http://www.decitre.fr/livres/le-monde-9782035869869.html,Delphine Godard,Larousse Jeunesse
05/10/2011,Lola,http://www.decitre.fr/livres/lola-9782081241978.html,Claire Mazard,Flammarion jeunesse
05/10/2011,Le coffre enchanté,http://www.decitre.fr/livres/le-coffre-enchante-9782203035119.html,Jean-François Chabas,Casterman
05/10/2011,Henderson's Boys Tome 4 Opération U-Boot,http://www.decitre.fr/livres/henderson-s-boys-tome-4-operation-u-boot-9782203037564.html,Robert Muchamore,Casterman
05/10/2011,Qui a piqué les contrôles de français ?,http://www.decitre.fr/livres/qui-a-pique-les-controles-de-francais-9782203037601.html,"Fanny Joly, Nicolas de Hirsching",Casterman
05/10/2011,Bartiméus. L'Anneau de Salomon,http://www.decitre.fr/livres/bartimeus-9782226230935.html,Jonathan Stroud,Albin Michel (Editions)
05/10/2011,Le hip-hop,http://www.decitre.fr/livres/le-hip-hop-9782330000424.html,Marie-Christine Vernay,Actes Sud Junior
05/10/2011,Une chanson d'ours,http://www.decitre.fr/livres/une-chanson-d-ours-9782358510776.html,Benjamin Chaud,Hélium
05/10/2011,Mon petit Cézanne,http://www.decitre.fr/livres/mon-petit-cezanne-9782711858972.html,Marie Sellier,RMN
05/10/2011,Comptines à chanter. Volume 1,http://www.decitre.fr/livres/comptines-a-chanter-9782745953636.html,Milan,Milan (Editions)
05/10/2011,Le grand livre de l'Or,http://www.decitre.fr/livres/le-grand-livre-de-l-or-9782745954497.html,Sandrine Mirza,Milan (Editions)
05/10/2011,Anatole Latuile Tome 5 Ultra top secret !,http://www.decitre.fr/livres/anatole-latuile-tome-5-ultra-top-secret-9782747039048.html,"Olivier Muller, Anne Didier, Clément Devaux",BD Kids
05/10/2011,Les Quatre de Baker Street Tome 3 Le rossignol de Stepney,http://www.decitre.fr/livres/les-quatre-de-baker-street-tome-3-le-rossignol-de-stepney-9782749306063.html,"David Etien, Jean-Blaise Djian, Olivier Legrand",Vents d'Ouest
05/10/2011,Le bus de Rosa,http://www.decitre.fr/livres/le-bus-de-rosa-9782848654706.html,"Fabrizio Silei, Maurizio Quarello",Sarbacane Editions
04/10/2011,Droits d'enfants,http://www.decitre.fr/cd/droits-d-enfants-3521383419762.html,"Léopoldine Gorret, Denis Alber",Formulette production
04/10/2011,L' alphabête avec 1 CD audio,http://www.decitre.fr/cd/l-alphabete-3700079261667.html,Pierre Jouishomme,Lugdivine
04/10/2011,Je colorie la Nativité,http://www.decitre.fr/livres/je-colorie-la-nativite-9781409529446.html,"Felicity Brooks, Samantha Meredith",Usborne Publishing
04/10/2011,Les Sauvenature Tome 4 Alerte aux cachalots !,http://www.decitre.fr/livres/les-sauvenature-tome-4-alerte-aux-cachalots-9782081262164.html,Thomas Leclere,Flammarion
04/10/2011,Le prince des Maudits Tome 2 Emil le clairvoyant,http://www.decitre.fr/livres/le-prince-des-maudits-tome-2-emil-le-clairvoyant-9782350670621.html,Lenia Major,Balivernes (Editions)
04/10/2011,Les fées des saisons,http://www.decitre.fr/livres/les-fees-des-saisons-9782364210110.html,Sandrine Lévy,Alpha Book Editions
04/10/2011,La nature en fête,http://www.decitre.fr/livres/la-nature-en-fete-9782917871171.html,"Catherine Lafaye Latteux, Virginie Rapiat",Planète rêvée
04/10/2011,Les petits jeux d'Attila,http://www.decitre.fr/livres/les-petits-jeux-d-attila-9782919934751.html,Calouan,Zoom éditions
04/10/2011,Gengis Kahn et la disparition du Kök Tengri,http://www.decitre.fr/livres/gengis-kahn-et-la-disparition-du-kok-tengri-9782919934768.html,Anna Boulanger,Zoom éditions
04/10/2011,Cléopâtre et la vraie vie,http://www.decitre.fr/livres/cleopatre-et-la-vraie-vie-9782919934775.html,Léna Ellka,Zoom éditions
04/10/2011,"Saladin, l'enfant sage",http://www.decitre.fr/livres/saladin-l-enfant-sage-9782919934782.html,Nicolas Lefrançois,Zoom éditions
04/10/2011,Olala !,http://www.decitre.fr/livres/olala-9782940456185.html,"Agnès Domergue, Lisa Charrier",Limonade (Editions)
04/10/2011,Les princesses de Marie. Carnet de coloriage 2,http://www.decitre.fr/livres/les-princesses-de-marie-9791090332027.html,Editions Duteil,Duteil (Editions)
04/10/2011,Maman ! Des monstres !,http://www.decitre.fr/livres/maman-des-monstres-9782917516201.html,"Liliana Cinetto, Poly Bernatene",Chocolat ! Jeunesse
04/10/2011,La comédie du sommeil avec 1 CD audio,http://www.decitre.fr/livres/la-comedie-du-sommeil-9782916059174.html,"Valeria Bruni-Tedeschi, Coco Tassel",Paja (Editions)
04/10/2011,L'étrange disparition de Piccola Bianca,http://www.decitre.fr/livres/l-etrange-disparition-de-piccola-bianca-9782917516218.html,"Mathieu Sabarly, Simon Moreau",Chocolat ! Jeunesse
04/10/2011,Les Sauvenature Tome 3 Urgence sur la banquise,http://www.decitre.fr/livres/les-sauvenature-tome-3-urgence-sur-la-banquise-9782081262157.html,Thomas Leclere,Flammarion
04/10/2011,Maman les p'tits bateaux. 13 chansons de toujours avec un orchestre symphonique avec 1 CD audio,http://www.decitre.fr/livres/maman-les-p-tits-bateaux-9791090597006.html,Bernadette Després,Bulles de Savon
03/10/2011,"Les Aventures de Vick et Vicky Tome 17 Vick, Vicky et les sauveteurs de la mer contre les voleurs de cerveaux",http://www.decitre.fr/livres/les-aventures-de-vick-et-vicky-tome-17-vick-vicky-et-les-sauveteurs-de-la-mer-contre-les-voleurs-de-cerveaux-9782914721615.html,Bruno Bertin,P'tit Louis (Editions)
03/10/2011,Le petit bateau de papier,http://www.decitre.fr/livres/le-petit-bateau-de-papier-9782953689488.html,Sylvick,Préau (Editions du)
03/10/2011,Le Père Noël arrive,http://www.decitre.fr/livres/le-pere-noel-arrive-9789461514899.html,Yoyo éditions,Yoyo Editions
03/10/2011,Sylvain et Sylvette Tome 5 La trêve de Noël,http://www.decitre.fr/livres/sylvain-et-sylvette-tome-5-la-treve-de-noel-9782914721561.html,Jean-Louis Pesch,P'tit Louis (Editions)
02/10/2011,Chante-moi les saisons,http://www.decitre.fr/livres/chante-moi-les-saisons-9782914096911.html,"Barbara Martinez, Florence Jenner-Metz",Callicéphale
02/10/2011,Juliette fait du vélo,http://www.decitre.fr/livres/juliette-fait-du-velo-9782244491370.html,Doris Lauer,Lito
02/10/2011,Boucle d'Or et les trois ours,http://www.decitre.fr/livres/boucle-d-or-et-les-trois-ours-9782244419701.html,"Marianne Barcilon, Anne Royer",Lito
02/10/2011,Lucine et Malo avec 1 CD audio,http://www.decitre.fr/livres/lucine-et-malo-9782863581193.html,Jean-Pierre Idatte,"[""3 Chardons"", ""Jeunesse""]"
01/10/2011,Quoi ? Le Curieux,http://www.decitre.fr/livres/quoi-le-curieux-3760181390693.html,Claire Nadaud,Eponymes (Editions)
01/10/2011,Michel Galabru raconte Ali Baba et les 40 voleurs,http://www.decitre.fr/livres/michel-galabru-raconte-ali-baba-et-les-40-voleurs-3760181390730.html,Michel Galabru,Eponymes (Editions)
01/10/2011,Michel Galabru raconte Peter Pan avec 1 CD audio,http://www.decitre.fr/livres/michel-galabru-raconte-peter-pan-3760181390747.html,Michel Galabru,Eponymes (Editions)
01/10/2011,Anny Duperey raconte Pinocchio avec 1 CD audio,http://www.decitre.fr/livres/anny-duperey-raconte-pinocchio-3760181390761.html,Anny Duperey,Eponymes (Editions)
01/10/2011,Petits canards,http://www.decitre.fr/livres/petits-canards-9781445445090.html,Parragon,Parragon
01/10/2011,Histoires du soir pour les garçons,http://www.decitre.fr/livres/histoires-du-soir-pour-les-garcons-9781445446837.html,"Derek Hall, Alison Morris, Louisa Somerville",Parragon
01/10/2011,Le voyage de M'Toto Lunettes avec 1 CD audio,http://www.decitre.fr/livres/le-voyage-de-m-toto-lunettes-9782296551558.html,Sylvie Mombo,L'Harmattan
01/10/2011,La belle histoire du beau Prince tout Moche,http://www.decitre.fr/livres/la-belle-histoire-du-beau-prince-tout-moche-9782296564886.html,Moussa Lebkiri,L'Harmattan
01/10/2011,Noël au Château,http://www.decitre.fr/livres/noel-au-chateau-9782353660858.html,Myriam Baudic,Eveil et découvertes
01/10/2011,Tatatoum. Eveil corporel & Chansons à mimer avec 1 CD audio,http://www.decitre.fr/livres/tatatoum-9782353660865.html,"Baptiste Amsallem, Laurent Lahaye, Thomas Dassonville, Isabelle Richard",Eveil et découvertes
01/10/2011,Les trois loulous de Nounou. La Journée du tout-petit chez sa nounou,http://www.decitre.fr/livres/les-trois-loulous-de-nounou-9782361280840.html,"Isabelle Damaret, Camille Piantanida",Libre label
01/10/2011,Les baobabs amoureux,http://www.decitre.fr/livres/les-baobabs-amoureux-9782362470202.html,Maiwenn Vuittenez,Océan Editions
01/10/2011,Mamie a besoin de bisous,http://www.decitre.fr/livres/mamie-a-besoin-de-bisous-9782362470219.html,Ana Bergua,Océan Editions
01/10/2011,La vraie folle histoire du gros canard jaune,http://www.decitre.fr/livres/la-vraie-folle-histoire-du-gros-canard-jaune-9782362470257.html,Nathalie Meynet,Océan Editions
01/10/2011,Abécédaire en 26 chansons avec 1 CD audio,http://www.decitre.fr/livres/abecedaire-en-26-chansons-9782362560262.html,"Tomi Ungerer, Boris Vian, Debout sur le zinc",Formulette production
01/10/2011,Droits d'enfants avec 2 CD audio,http://www.decitre.fr/livres/droits-d-enfants-9782362560293.html,"Léopoldine Gorret, Denis Alber",Formulette production
01/10/2011,Bébé-musique Opéra avec 1 CD audio,http://www.decitre.fr/livres/bebe-musique-opera-9782362850240.html,Christophe Bonacorsi,Mots Magiques (Les)
01/10/2011,Les fabuletttes. Joyeux Noël avec 1 CD audio,http://www.decitre.fr/livres/les-fabuletttes-9782362850257.html,Anne Sylvestre,Mots Magiques (Les)
01/10/2011,Mnémo le gardien des mots,http://www.decitre.fr/livres/mnemo-le-gardien-des-mots-9782364210073.html,Bénédicte Carboneill,Alpha Book Editions
01/10/2011,Le mouton qui voulait être loup,http://www.decitre.fr/livres/le-mouton-qui-voulait-etre-loup-9782364210080.html,Marie-Hélène Lafond,Alpha Book Editions
01/10/2011,Un hippopotame couleur fraise des bois,http://www.decitre.fr/livres/un-hippopotame-couleur-fraise-des-bois-9782364210097.html,Armelle Renoult,Alpha Book Editions
01/10/2011,Beaudragon,http://www.decitre.fr/livres/beaudragon-9782364210103.html,"Régine Raymond-Garcia, Eva Kopp",Alpha Book Editions
01/10/2011,Jack et le sapin magique,http://www.decitre.fr/livres/jack-et-le-sapin-magique-9782364210127.html,Céline Lamour-Crochet,Alpha Book Editions
01/10/2011,Mais où est la grenouille de Farfouille ?,http://www.decitre.fr/livres/mais-ou-est-la-grenouille-de-farfouille-9782365920018.html,Alexis Ferrier,Grrr...art
01/10/2011,Hélio,http://www.decitre.fr/livres/helio-9782748368277.html,Tony Hassa,Publibook/Société écrivains
01/10/2011,Les contes de la lune,http://www.decitre.fr/livres/les-contes-de-la-lune-9782823100372.html,Elisabeth Delaigle,Persée (Editions)
01/10/2011,Nouvelles vieilles histoire. 7 épisodes peu connus tirés de la Bible,http://www.decitre.fr/livres/nouvelles-vieilles-histoire-9782826035350.html,Suzanne Berney,Maison de La Bible (la)
01/10/2011,Abracadabra !. Fini la pollution !,http://www.decitre.fr/livres/abracadabra-fini-la-pollution-9782846312707.html,Cathie Ollier,Bellier (Editions)
01/10/2011,Un kangourou pour Noël,http://www.decitre.fr/livres/un-kangourou-pour-noel-9782358510851.html,Flora James,Hélium
01/10/2011,Panthéon vaudou. Coloriages avec Patrick Vilaire,http://www.decitre.fr/livres/pantheon-vaudou-9782869250949.html,Patrick Vilaire,Fondation Cartier
01/10/2011,Fables en argot,http://www.decitre.fr/cd/fables-en-argot-9782895583684.html,Jean de La Fontaine,Alexandre Stanké
01/10/2011,"Vite, vite ! C'est Noël !",http://www.decitre.fr/livres/vite-vite-c-est-noel-9782912138910.html,"Olivier Bardy, François Aubin",Points de Suspension
01/10/2011,Les aventures de Majid Tome 2 Missions byzantines,http://www.decitre.fr/livres/les-aventures-de-majid-tome-2-missions-byzantines-9782916637150.html,"Hugues Beaujard, Emily Nudd-Mitchell",Dadoclem
01/10/2011,Le grimoire pourpre Tome 2 Les sorcières rouges,http://www.decitre.fr/livres/le-grimoire-pourpre-tome-2-les-sorcieres-rouges-9782917032299.html,Michaël Bettinelli,Les Ardents
01/10/2011,Le voyage vers l'ouest,http://www.decitre.fr/livres/le-voyage-vers-l-ouest-9782917582206.html,Sylvie de Mathuisieulx,Calleva
01/10/2011,C'est quand qu'on est grand ?,http://www.decitre.fr/livres/c-est-quand-qu-on-est-grand-9782917637210.html,"Giovanna Zecchinato-Inal, Caroline Dalla",L'initiale
01/10/2011,La bande des super Tome 1 Mon père est un agent top-secret,http://www.decitre.fr/livres/la-bande-des-super-tome-1-mon-pere-est-un-agent-top-secret-9788415051411.html,"Pierre Fouillet, Christine Beigel",Bang Editions
01/10/2011,Nana Caneton. Super livre d'activités,http://www.decitre.fr/livres/nana-caneton-9789088461446.html,Lieve Boumans,Olala Books
01/10/2011,La ferme. 9 petits livres,http://www.decitre.fr/livres/la-ferme-9789461514424.html,Yoyo éditions,Yoyo Editions
01/10/2011,L'Etoile musicale,http://www.decitre.fr/livres/l-etoile-musicale-9789461514608.html,Yoyo éditions,Yoyo Editions
01/10/2011,Les formes,http://www.decitre.fr/livres/les-formes-9789461514684.html,Yoyo éditions,Yoyo Editions
01/10/2011,Le renne du Père Noël,http://www.decitre.fr/livres/le-renne-du-pere-noel-9789461514752.html,Yoyo éditions,Yoyo Editions
01/10/2011,Les rennes du Père Noël,http://www.decitre.fr/livres/les-rennes-du-pere-noel-9789461514905.html,Yoyo éditions,Yoyo Editions
01/10/2011,Mouton rouge,http://www.decitre.fr/livres/mouton-rouge-9789461517210.html,Yoyo éditions,Yoyo Editions
01/10/2011,Chat bleu,http://www.decitre.fr/livres/chat-bleu-9789461517227.html,Yoyo éditions,Yoyo Editions
01/10/2011,Chien jaune,http://www.decitre.fr/livres/chien-jaune-9789461517234.html,Yoyo éditions,Yoyo Editions
01/10/2011,La Guerre des Eléments,http://www.decitre.fr/livres/la-guerre-des-elements-9782746639522.html,Perrine Rousselot,Rousselot Perrine
01/10/2011,"Guillaume-Joseph Chaminade, fondateur de la famille marianiste. Vivre l'Evangile avec Marie",http://www.decitre.fr/livres/guillaume-joseph-chaminade-fondateur-de-la-famille-marianiste-9782746827103.html,"Mariano Valsesia, Marie Malcurat, Véronique Noël",Signe (Editions du)
01/10/2011,Envole-toi petit chagrin,http://www.decitre.fr/livres/envole-toi-petit-chagrin-9782952928076.html,Colette Delpon,Majarogi
01/10/2011,Célestin fête Noël,http://www.decitre.fr/livres/celestin-fete-noel-9791090196094.html,"Nancy Guilbert, Laure Phélipon",P'tits Totems (Les)
01/10/2011,Les Escogriffes Tome 1 La rencontre,http://www.decitre.fr/livres/les-escogriffes-tome-1-la-rencontre-9782953296310.html,"Annouck Lepla, Peggy Pizzadili, Cécile Pouget",Akha Biladjo !
01/10/2011,Quand je serai grand je serai grand méchant loup,http://www.decitre.fr/livres/quand-je-serai-grand-je-serai-grand-mechant-loup-9782919523023.html,"Anne-Gaëlle Balpe, Emilia Conesa",Winioux (Editions)
01/10/2011,"Les Fabulettes. Volume 2, Chansons pour tous les temps avec 1 CD audio",http://www.decitre.fr/cd/les-fabulettes-3259130181456.html,Anne Sylvestre,Epm Editions
01/10/2011,L'abécédaire du petit écolier,http://www.decitre.fr/livres/l-abecedaire-du-petit-ecolier-9782918245216.html,"Valérie Weishar-Giuliani, Chadia Chaïbi Loueslati",Samsara (Editions des)
01/10/2011,La nouvelle vie d'Aliénor,http://www.decitre.fr/livres/la-nouvelle-vie-d-alienor-9782915125887.html,Aline de Pétigny,Pour penser à l'endroit
01/10/2011,"Albert, le croque-notes. Albert trouve sa voix",http://www.decitre.fr/livres/albert-le-croque-notes-9782918373124.html,Arnaud Roi,Adabam (Editions)
01/10/2011,Deux histoires policières. Le rapt du cacatoès ; Des assassins au paradis,http://www.decitre.fr/livres/deux-histoires-policieres-9782916279527.html,Philippe Barbeau,Airvey Editions
01/10/2011,Les combattants de l'ombre. La résistance européenne 1939-1945 avec 3 DVD,http://www.decitre.fr/dvd-video/les-combattants-de-l-ombre-3453277851993.html,Bernard George,Arte Vidéo Editions
01/10/2011,Ani'mots,http://www.decitre.fr/livres/ani-mots-9782358630405.html,François Seine,Le Pré du Plain
01/10/2011,Heidi,http://www.decitre.fr/livres/heidi-9782324000805.html,Johanna Spyri,Gründ
01/10/2011,Soixante secondes de papillon. Des poètes à chanter et à écouter avec 1 CD audio,http://www.decitre.fr/livres/soixante-secondes-de-papillon-9791090597013.html,"Carine Sanson, Jean René",Bulles de Savon
01/10/2011,Regarde le brin d'herbe. Des poètes à chanter et à écouter avec 1 CD audio,http://www.decitre.fr/livres/regarde-le-brin-d-herbe-9791090597020.html,"Marie-Charlotte Aguerre, Jean René",Bulles de Savon
01/10/2011,Petits lapins,http://www.decitre.fr/livres/petits-lapins-9781445445083.html,Parragon,Parragon
01/10/2011,La château oublié de Saôu,http://www.decitre.fr/livres/la-chateau-oublie-de-saou-9782310010085.html,Dolly Buisson-Côte,Amalthée
01/10/2011,Mon premier livre de Noël,http://www.decitre.fr/livres/mon-premier-livre-de-noel-9782753019089.html,Piccolia,Piccolia
01/10/2011,Célestin et le cirque des chiffres,http://www.decitre.fr/livres/celestin-et-le-cirque-des-chiffres-9791090196063.html,"Nancy Guilbert, Laure Phélipon",P'tits Totems (Les)
01/10/2011,"La Bible Segond 21. L'original, avec les mots d'aujourd'hui 3e édition 2011",http://www.decitre.fr/livres/la-bible-segond-21-9782608122155.html,Société biblique de Genève,Société Biblique de Genève
01/10/2011,L'odyssée sonore. La Reine des Neiges avec 1 CD audio,http://www.decitre.fr/cd/l-odyssee-sonore-3341348375182.html,Hans Christian Andersen,Eveil et découvertes
01/10/2011,Au Monstre !,http://www.decitre.fr/livres/au-monstre-9782353660841.html,Huguette Pizzic,Eveil et découvertes
01/10/2011,Le cinéma,http://www.decitre.fr/livres/le-cinema-9782745956903.html,Marilyne Letertre,Milan (Editions)
01/10/2011,Les Ramasse-miettes,http://www.decitre.fr/livres/les-ramasse-miettes-9782353610365.html,Catherine Zambon,La Fontaine
01/10/2011,Danses Folkloriques de France pour les enfants avec 1 CD audio,http://www.decitre.fr/livres/danses-folkloriques-de-france-pour-les-enfants-9782362560286.html,Didier Lhotte,Formulette production
01/10/2011,Ma boîte à Billes,http://www.decitre.fr/livres/ma-boite-a-billes-9782324000416.html,Emmanuelle Radiguer,Gründ
01/10/2011,"Le Maudit Sapin. Pacotille, Ratapène et Comédon",http://www.decitre.fr/livres/le-maudit-sapin-9782364210134.html,Lucile Thibaudier,Alpha Book Editions
01/10/2011,"Baptiste, fils d'ostréiculteur à Mèze",http://www.decitre.fr/livres/baptiste-fils-d-ostreiculteur-a-meze-9782841664306.html,Adam Delatour-Turi,Grandir
01/10/2011,Lulu aime-t-il Noël ?,http://www.decitre.fr/livres/lulu-aime-t-il-noel-9782916910109.html,"Betty Ruby, Shima",Eva Editions
01/10/2011,Prions en Eglise Junior Hors-série Décembre Le chemin vers Noël jusqu'à l'Epiphanie,http://www.decitre.fr/revues/prions-en-eglise-junior-hors-serie-decembre-2011-le-chemin-vers-noel-jusqu-a-l-epiphanie-5552600507120.html,"Jacques Nieuviarts, Emmanuelle Rémond-Dalyac",Bayard Presse
01/10/2011,Lola reine des princesses,http://www.decitre.fr/livres/lola-reine-des-princesses-9782211205344.html,"Claude-K Dubois, Carl Norac",Ecole des Loisirs (L')
01/10/2011,Petit bout bourlingue avec 1 CD audio,http://www.decitre.fr/livres/petit-bout-bourlingue-9782746632202.html,"Emilie Pouyer, Alexandre Sauvion",L'ASso'rise sur la gâteau
01/10/2011,Saint-Nicolas. Bloc à colorier junior,http://www.decitre.fr/livres/saint-nicolas-9789037481761.html,Ballon,Ballon
01/10/2011,Le Père Noël,http://www.decitre.fr/livres/le-pere-noel-9789461514745.html,Yoyo éditions,Yoyo Editions
01/10/2011,Amos Daragon Tome 6 La Colère d'Enki,http://www.decitre.fr/livres/amos-daragon-tome-6-la-colere-d-enki-9782266224062.html,Bryan Perro,Pocket Jeunesse
01/10/2011,L'arbre qui ne tenait pas ses promesses,http://www.decitre.fr/livres/l-arbre-qui-ne-tenait-pas-ses-promesses-9782913574571.html,Emmanuel Parmentier,Grrr...art
01/10/2011,A l'assaut des montagnes avec 1 DVD,http://www.decitre.fr/livres/a-l-assaut-des-montagnes-9782215055426.html,Emeline Lebouteiller,Fleurus
01/10/2011,"Filotéo Hors-série La Bible en BD, au commencement du monde...",http://www.decitre.fr/revues/filoteo-hors-serie-la-bible-en-bd-au-commencement-du-monde-3260050786829.html,Florence Dutruc-Rosset,Bayard Presse
01/10/2011,Un fil à la patte avec 1 DVD,http://www.decitre.fr/dvd-video/un-fil-a-la-patte-3346030023563.html,"Georges Feydeau, Jérôme Deschamps, Dominique Thiel","[""Montparnasse Editions"", ""Grand Format""]"
01/10/2011,Satin grenadine,http://www.decitre.fr/livres/satin-grenadine-9782211205504.html,Marie Desplechin,Ecole des Loisirs (L')
01/10/2011,Sibo et la petite Mami Wata,http://www.decitre.fr/livres/sibo-et-la-petite-mami-wata-9782296564862.html,Anselme Djeukam,L'Harmattan
01/10/2011,"Narou le kangourou, Barca le crabe. Histoires imaginées par les élèves du CPA",http://www.decitre.fr/livres/narou-le-kangourou-barca-le-crabe-9782296564879.html,"Marie Duvignau, Florence Sautereau",L'Harmattan
01/10/2011,Mort suspecte au Piwi Hôtel. Kenya,http://www.decitre.fr/livres/mort-suspecte-au-piwi-hotel-9782296564947.html,Patrice Baluc-Rittener,L'Harmattan
01/10/2011,Passage en Outre-Monde Tome 1 Le Tourneur de Page,http://www.decitre.fr/livres/passage-en-outre-monde-tome-1-le-tourneur-de-page-9782353660872.html,Muriel Zürcher,Eveil et découvertes
01/10/2011,Ysée Tome 1 Le Reliquaire d'argent,http://www.decitre.fr/livres/ysee-tome-1-le-reliquaire-d-argent-9782747039352.html,Evelyne Brisou-Pellen,Bayard Jeunesse
01/10/2011,La chaine des temps,http://www.decitre.fr/livres/la-chaine-des-temps-9782748367843.html,Ebde,Publibook/Société écrivains
01/10/2011,Un amour sous la Terreur Edition en gros caractères,http://www.decitre.fr/livres/un-amour-sous-la-terreur-edition-en-gros-caracteres-9782843795305.html,Dominique Legrand,Encre bleue
01/10/2011,L'arbre roux avec 1 CD audio,http://www.decitre.fr/livres/l-arbre-roux-9782863581322.html,Jean-Pierre Idatte,"[""3 Chardons"", ""Jeunesse""]"
01/10/2011,Pas de moutons pour Pépita !,http://www.decitre.fr/livres/pas-de-moutons-pour-pepita-9782896512935.html,"Lili Chartrand, Yves Dumont",La Courte Echelle
