pub_date,link_to_book/_text,link_to_book,author,publisher
23/11/2011,Les p'tits diables Les p'tits diables contre-attaquent !. Compil' 3D avec lunettes en cadeau,http://www.decitre.fr/livres/les-p-tits-diables-les-p-tits-diables-contre-attaquent-compil-3d-avec-lunettes-en-cadeau-9782302018389.html,Olivier Dutto,Soleil Productions
23/11/2011,Le dernier Orc. Tome 2,http://www.decitre.fr/livres/le-dernier-orc-9782013229173.html,Silvana De Mari,Hachette
23/11/2011,L'inavouable secret de Clara,http://www.decitre.fr/livres/l-inavouable-secret-de-clara-9782706708817.html,Elisabeth Bourgois,Salvator
23/11/2011,Le Chat Potté. Le maître d'armes de Rancho Castillo,http://www.decitre.fr/livres/le-chat-potte-9782723486996.html,DreamWorks,Glénat
23/11/2011,L'écologie,http://www.decitre.fr/livres/l-ecologie-9782758304487.html,Cerise bleue,Cerise bleue
23/11/2011,L'imagier des bobos,http://www.decitre.fr/livres/l-imagier-des-bobos-9782758304548.html,Vernius,Cerise bleue
23/11/2011,L'imagier des enfants,http://www.decitre.fr/livres/l-imagier-des-enfants-9782758304517.html,Vernius,Cerise bleue
23/11/2011,Signé Juliette Tome 4 100% déco,http://www.decitre.fr/livres/signe-juliette-tome-4-100-deco-9782012022928.html,Sophie Dieuaide,Hachette
23/11/2011,Eco Tome 2 La Bête sans visage,http://www.decitre.fr/livres/eco-tome-2-la-bete-sans-visage-9782302015654.html,"Jérémie Almanza, Guillaume Bianco",Soleil Productions
23/11/2011,Abandon Tome 1,http://www.decitre.fr/livres/abandon-tome-1-9782012023581.html,Meg Cabot,Hachette
23/11/2011,Le petit théâtre de Rébecca,http://www.decitre.fr/livres/le-petit-theatre-de-rebecca-9782013936118.html,Rébecca Dautremer,Hachette
23/11/2011,Cherub Tome 1 100 jours en enfer,http://www.decitre.fr/livres/cherub-tome-1-100-jours-en-enfer-9782203026506.html,Robert Muchamore,Casterman
23/11/2011,Les étranges aventures Tome 2 Le Cirque Infernal,http://www.decitre.fr/livres/les-etranges-aventures-tome-2-le-cirque-infernal-9782352887942.html,Alexandra Adornetto,City Editions
23/11/2011,Comment sauver un vampire amoureux,http://www.decitre.fr/livres/comment-sauver-un-vampire-amoureux-9782702436196.html,Beth Fantaskey,Masque (Editions du)
22/11/2011,Anny Duperey raconte. Blanche Neige ; Pinocchio ; Alice au Pays des Merveilles ; La Belle et la Bête avec 2 CD audio,http://www.decitre.fr/livre-audio/anny-duperey-raconte-3760181390891.html,Anny Duperey,Eponymes
22/11/2011,Cendrillon ou la pantoufle de verre,http://www.decitre.fr/livres/cendrillon-ou-la-pantoufle-de-verre-9782354811181.html,Charles Perrault,Thomas Jeunesse
22/11/2011,Bébé musique. Coffret 5 livres-CD : Piano ; Opéra ; Classqiue ; Mozart ; Jazz avec 5 CD audio,http://www.decitre.fr/livres/bebe-musique-9782362850271.html,Christophe Bonacorsi,Mots Magiques (Les)
22/11/2011,Les animaux de Benjamin Rabier,http://www.decitre.fr/livres/les-animaux-de-benjamin-rabier-9782878335866.html,"Benjamin Rabier, Georges Louis Leclerc",Circonflexe
22/11/2011,Grosses bêtes & petites bêtes,http://www.decitre.fr/livres/grosses-betes-petites-betes-9782878335927.html,André Hellé,Circonflexe
22/11/2011,Mais arrête Peskett !,http://www.decitre.fr/livres/mais-arrete-peskett-9782919506071.html,"May, Pylb",Canto Editions
22/11/2011,L'Extraordinaire voyage de Lulu,http://www.decitre.fr/livres/l-extraordinaire-voyage-de-lulu-9782210979987.html,"Daniel Picouly, Frédéric Pillot",Magnard Jeunesse
22/11/2011,Michel Galabru raconte. Ali Baba et les 40 voleurs ; Peter Pan ; Le Petit Chaperon Rouge ; Tom Pouce avec 2 CD audio,http://www.decitre.fr/livre-audio/michel-galabru-raconte-3760181390907.html,Michel Galabru,Eponymes
22/11/2011,Dragons et créatures mythiques,http://www.decitre.fr/livres/dragons-et-creatures-mythiques-9782896603053.html,Claudine Gandolfi,Presses Aventure
22/11/2011,Safari sauvage. Tourbillons colorés et motifs scintillants à découvrir !,http://www.decitre.fr/livres/safari-sauvage-9782896603060.html,Heather Zschock,Presses Aventure
22/11/2011,"Pomme d'Api Soleil N°91, juin-juillet 2 Obéir, est-ce que ça empêche d'être libre ?",http://www.decitre.fr/revues/pomme-d-api-soleil-n-91-juin-juillet-2011-obeir-est-ce-que-ca-empeche-d-etre-libre-3260050786287.html,Agnès Rochefort-Turquin,Bayard Presse
22/11/2011,Heidi au pays des chevaux ! avec 1 CD audio,http://www.decitre.fr/cd/heidi-au-pays-des-chevaux-1-cd-audio-9782365160032.html,Les Dagobert,Eponymes
22/11/2011,Lyon 8 décembre fête des Lumières. Entrez dans la magie de la fête des lumières avec 1 DVD,http://www.decitre.fr/dvd-video/lyon-8-decembre-fete-des-lumieres-3760084080363.html,Christian Salès,Christian Salès (Editions)
22/11/2011,Le Petit Chaperon Rouge,http://www.decitre.fr/livres/le-petit-chaperon-rouge-9782354811174.html,Charles Perrault,Thomas Jeunesse
22/11/2011,Pinocchio,http://www.decitre.fr/livres/pinocchio-9788836621477.html,Carlo Collodi,Silvana Editoriale
18/11/2011,Ben Bella. De la libération de la France à celle de l'Algérie,http://www.decitre.fr/livres/ben-bella-9782350007984.html,Gérard Streiff,Oskar
18/11/2011,Sous la vague avec Hokusaï,http://www.decitre.fr/livres/sous-la-vague-avec-hokusai-9782350008004.html,Christine Féret-Fleury,Oskar
18/11/2011,"Anissa, je t'aime",http://www.decitre.fr/livres/anissa-je-t-aime-9782350008028.html,Clotilde Bernos,Oskar
18/11/2011,Le Petit Singe et la Lune,http://www.decitre.fr/livres/le-petit-singe-et-la-lune-9782353480326.html,Tomonori Taniguchi,Le Petit Lézard
18/11/2011,"Ne vends pas ton âme, Indio !",http://www.decitre.fr/livres/ne-vends-pas-ton-ame-indio-9782350007960.html,Roger Judenne,Oskar
18/11/2011,Les 5 derniers dragons Tome 2 L'épreuve,http://www.decitre.fr/livres/les-5-derniers-dragons-tome-2-l-epreuve-9782896674114.html,Danielle Dumais,ADA Jeunesse
18/11/2011,Les Arckans. Obscurités,http://www.decitre.fr/livres/les-arckans-9782350008059.html,Jean-Marie Defossez,Oskar
18/11/2011,"Le Père Noël, l'Ogre et la Licorne avec 1 CD audio",http://www.decitre.fr/livres/le-pere-noel-l-ogre-et-la-licorne-9782849541128.html,Jean-Michel Sananes,Chemins de Plume
18/11/2011,Yakari l'ami des animaux L'ami des loups,http://www.decitre.fr/livres/yakari-l-ami-des-animaux-l-ami-des-loups-9782803629749.html,"Derib, Job",Lombard
18/11/2011,Ku Klux Klan Tome 2 Terreur au Mississippi,http://www.decitre.fr/livres/ku-klux-klan-tome-2-terreur-au-mississippi-9782350007953.html,Roger Martin,Oskar
18/11/2011,Strange Angels Tome 1,http://www.decitre.fr/livres/strange-angels-tome-1-9782362310379.html,Lili Saint-Crow,Castelmore
18/11/2011,Clifton Intégrale Tome 6,http://www.decitre.fr/livres/clifton-integrale-tome-6-9782803628650.html,"Bob De Groot, Michel Rodrigue",Lombard
18/11/2011,Bobby,http://www.decitre.fr/livres/bobby-9782923841076.html,Mélanie Baillairgé,Pastèque (Editions de la)
18/11/2011,L'épée du pouvoir,http://www.decitre.fr/livres/l-epee-du-pouvoir-9782350008042.html,Georges Foveau,Oskar
18/11/2011,Michel Vaillant l'Intégrale Tome 14,http://www.decitre.fr/livres/michel-vaillant-l-integrale-tome-14-9782803629725.html,Jean Graton,Lombard
18/11/2011,Mandalas - L'art du voyage intérieur. Tome 3 : puissance d'action - 18 mandalas à colorier et 2 à créer,http://www.decitre.fr/livres/mandalas-l-art-du-voyage-interieur-9782896674756.html,Joane Michaud,AdA éditions
18/11/2011,Georges N° 4 Trompette,http://www.decitre.fr/revues/georges-n-4-trompette-9782953852752.html,Anne-Bénédicte Schwebel,Grains de sel
18/11/2011,Barbe bleue et Compè Lapin,http://www.decitre.fr/livres/barbe-bleue-et-compe-lapin-9782953434309.html,"La Luciole masquée, Joël Cimarrón",Karibencyla
18/11/2011,La Belle et Ganesh,http://www.decitre.fr/livres/la-belle-et-ganesh-9782953434316.html,"La Luciole masquée, Joël Cimarrón",Karibencyla
18/11/2011,Blanche Neige et les Korrigans,http://www.decitre.fr/livres/blanche-neige-et-les-korrigans-9782953434323.html,La Luciole masquée,Karibencyla
18/11/2011,Petit Poucet et le Minotaure,http://www.decitre.fr/livres/petit-poucet-et-le-minotaure-9782953434330.html,Fabienne Gambrelle,Karibencyla
18/11/2011,Quand ils ont su...,http://www.decitre.fr/livres/quand-ils-ont-su-9782352891307.html,Malika Doray,MeMo (Editions)
18/11/2011,Monster High Tome 3 Quand on parle du loup...,http://www.decitre.fr/livres/monster-high-tome-3-quand-on-parle-du-loup-9782362310355.html,Lisi Harrison,Castelmore
18/11/2011,Kiam Tasgall Tome 2 L'orbe d'Yrulmeth,http://www.decitre.fr/livres/kiam-tasgall-tome-2-l-orbe-d-yrulmeth-9782896672929.html,Nadine Bertholet,AdA éditions
18/11/2011,Les chroniques de Victor Pelham Tome 4 Le métronome de Maébiel,http://www.decitre.fr/livres/les-chroniques-de-victor-pelham-tome-4-le-metronome-de-maebiel-9782896674527.html,Pierre-Olivier Lavoie,AdA éditions
18/11/2011,Fourchon,http://www.decitre.fr/livres/fourchon-9782923841038.html,"Isabelle Arsenault, Kyo Maclear",Pastèque (Editions de la)
18/11/2011,La mer,http://www.decitre.fr/livres/la-mer-9782923841045.html,Marianne Dubuc,Pastèque (Editions de la)
17/11/2011,Le Petit Prince La Planète de l'Astronome. Edition prestige - avec 1 DVD,http://www.decitre.fr/livres/le-petit-prince-la-planete-de-l-astronome-9782070642625.html,Antoine de Saint-Exupéry,Gallimard jeunesse
17/11/2011,Le Petit Prince Tome 5 Et les Globus,http://www.decitre.fr/livres/le-petit-prince-tome-5-et-les-globus-9782070642717.html,Katherine Quenot,Gallimard jeunesse
17/11/2011,Le Petit Prince Tome 6 Le Petit Prince et l'Astronome,http://www.decitre.fr/livres/le-petit-prince-tome-6-le-petit-prince-et-l-astronome-9782070642724.html,Katherine Quenot,Gallimard-Jeunesse
17/11/2011,Allô Mamie ?,http://www.decitre.fr/livres/allo-mamie-9782211205573.html,Frédéric Stehr,Ecole des Loisirs (L')
17/11/2011,Le retour de la demoiselle,http://www.decitre.fr/livres/le-retour-de-la-demoiselle-9782211205658.html,Cathy Ytak,Ecole des Loisirs (L')
17/11/2011,Société Protectrice des Monstres Tome 5 La bataille des zombies,http://www.decitre.fr/livres/societe-protectrice-des-monstres-tome-5-la-bataille-des-zombies-9782266190107.html,"Matthew Morgan, David Sinden, Guy Macdonald",Pocket Jeunesse
17/11/2011,Petit Tom et la tata qui pique,http://www.decitre.fr/livres/petit-tom-et-la-tata-qui-pique-9782350007540.html,Didier Lévy,Oskar
17/11/2011,Pomme de reinette,http://www.decitre.fr/livres/pomme-de-reinette-9782352270638.html,Christine Beigel,Après la lune
17/11/2011,Une poule sur un mur,http://www.decitre.fr/livres/une-poule-sur-un-mur-9782352270645.html,Julia Chausson,Après la Lune Jeunesse
17/11/2011,Lilichou coquette,http://www.decitre.fr/livres/lilichou-coquette-9782354501860.html,Adolie Day,Coédition Amaterra/Nouvel Angle
17/11/2011,Pacha Botté et l'ogre de Crazannes,http://www.decitre.fr/livres/pacha-botte-et-l-ogre-de-crazannes-9782361990275.html,Olivier Fouché,Le Croît vif
17/11/2011,Le cochon d'Angélina,http://www.decitre.fr/livres/le-cochon-d-angelina-9782361990282.html,"Noël Pietri, Philippe Gaufreteau",Le Croît vif
17/11/2011,La princesse qui chantait comme une casserole,http://www.decitre.fr/livres/la-princesse-qui-chantait-comme-une-casserole-9782363250179.html,"Claude Bathany, Joël Legars",Gargantua (Editions)
17/11/2011,Un corsaire,http://www.decitre.fr/livres/un-corsaire-9782363250186.html,"Eugène Sue, Marc Lizano",Gargantua (Editions)
17/11/2011,Perpétue,http://www.decitre.fr/livres/perpetue-9782364860001.html,Benjamin Rabier,"[""Langlaude (Editions)"", ""Livre neuf à prix réduit""]"
17/11/2011,Charlot est un phénomène,http://www.decitre.fr/livres/charlot-est-un-phenomene-9782364860018.html,Benjamin Rabier,"[""Langlaude (Editions)"", ""Livre neuf à prix réduit""]"
17/11/2011,Trotte-Menu,http://www.decitre.fr/livres/trotte-menu-9782364860025.html,Benjamin Rabier,"[""Langlaude (Editions)"", ""Livre neuf à prix réduit""]"
17/11/2011,Joséphine,http://www.decitre.fr/livres/josephine-9782364860032.html,Benjamin Rabier,"[""Langlaude (Editions)"", ""Livre neuf à prix réduit""]"
17/11/2011,Maître Renard,http://www.decitre.fr/livres/maitre-renard-9782364860049.html,Benjamin Rabier,"[""Langlaude (Editions)"", ""Livre neuf à prix réduit""]"
17/11/2011,Le grand pélican blanc,http://www.decitre.fr/livres/le-grand-pelican-blanc-9782364860056.html,Benjamin Rabier,"[""Langlaude (Editions)"", ""Livre neuf à prix réduit""]"
17/11/2011,Fabuleuses histoires de graines,http://www.decitre.fr/livres/fabuleuses-histoires-de-graines-9782701154657.html,"Lionel Hignard, Biosphoto",Belin
17/11/2011,SamSam Tome 29 Une gaffe galactique,http://www.decitre.fr/livres/samsam-tome-29-une-gaffe-galactique-9782747034654.html,Serge Bloch,Bayard Jeunesse
17/11/2011,SamSam Tome 30 Le défi cosmique,http://www.decitre.fr/livres/samsam-tome-30-le-defi-cosmique-9782747036122.html,Serge Bloch,Bayard Jeunesse
17/11/2011,La ferme aux quatre saisons,http://www.decitre.fr/livres/la-ferme-aux-quatre-saisons-9782758304814.html,Cerise bleue,Cerise bleue
17/11/2011,La vie secrète du loup. 3 petits livres,http://www.decitre.fr/livres/la-vie-secrete-du-loup-9782848016276.html,Edouard Manceau,Tourbillon
17/11/2011,Mon mémo des plus beaux contes,http://www.decitre.fr/livres/mon-memo-des-plus-beaux-contes-9782848016399.html,"Charlotte Roederer, Vincent Mathy, Mélanie Combes, Éléonore Zuber",Tourbillon
17/11/2011,Le Noël du petit Gnouf,http://www.decitre.fr/livres/le-noel-du-petit-gnouf-9782895129974.html,"Dominique Demers, Gabrielle Grimard",Dominique et Compagnie
17/11/2011,Méli-mélo de Binou,http://www.decitre.fr/livres/meli-melo-de-binou-9782896860043.html,Dominique Jolin,Dominique et Compagnie
17/11/2011,Fausse note au ranch,http://www.decitre.fr/livres/fausse-note-au-ranch-9782913647886.html,Françoise Laurent,Rouge Safran
17/11/2011,On s'aime quand même. Moi je peux,http://www.decitre.fr/livres/on-s-aime-quand-meme-9782917045169.html,"Nathalie Choux, Galia Tapiero",Kilowatt
17/11/2011,Mella. Tralala !,http://www.decitre.fr/livres/mella-9782923506319.html,Hélène Desputeaux,Desputeaux + Aubin
17/11/2011,365 paroles de la Bible,http://www.decitre.fr/livres/365-paroles-de-la-bible-9782747034906.html,"Katia Mrowiec, Martine Laffon, Jacques Nieuviarts",Bayard Jeunesse
17/11/2011,"Menaçants, inquiétants, fascinants... Ces animaux mal-aimés",http://www.decitre.fr/livres/menacants-inquietants-fascinants-9782701161747.html,"Yann Rigaud, Biosphoto",Belin
17/11/2011,SamSam n'aime que les bonbons,http://www.decitre.fr/livres/samsam-n-aime-que-les-bonbons-9782747035248.html,"Serge Bloch, Astrid Scaramus",Bayard Jeunesse
17/11/2011,La folle expédition de Ma'Bobine et Moutonléon,http://www.decitre.fr/livres/la-folle-expedition-de-ma-bobine-et-moutonleon-9782747038492.html,Marie Vaudescal,Bayard Poche
17/11/2011,365 jeux pour les filles. Un jeu chaque jour !,http://www.decitre.fr/livres/365-jeux-pour-les-filles-9782896388950.html,Goélette (éditions),Goélette (Editions)
17/11/2011,Les lapins rouges n'existent pas,http://www.decitre.fr/livres/les-lapins-rouges-n-existent-pas-9782211203333.html,Iris de Moüy,Ecole des Loisirs (L')
17/11/2011,Cocoloriage,http://www.decitre.fr/livres/cocoloriage-9782211205580.html,Dorothée de Monfreid,Ecole des Loisirs (L')
17/11/2011,Le goûter,http://www.decitre.fr/livres/le-gouter-9782211206587.html,Kimiko,Ecole des Loisirs (L')
17/11/2011,Paulo cherche ses amis,http://www.decitre.fr/livres/paulo-cherche-ses-amis-9782354501877.html,Séverine Cordier,Coédition Amaterra/Nouvel Angle
17/11/2011,"La Lune. Influences, symbolisme et sortilèges. Comment l'astre de la nuit affecte vos émotions 2e édition",http://www.decitre.fr/livres/la-lune-9782764017142.html,Thierry O'Brien,Québecor
17/11/2011,La visite de saint Nicolas et du Hans,http://www.decitre.fr/livres/la-visite-de-saint-nicolas-et-du-hans-9782914096966.html,"Jean-Luc Burger, Alexandre Roane",Callicéphale
17/11/2011,Ben 10 Alien Force Tome 8 Le secret de Gwen,http://www.decitre.fr/livres/ben-10-alien-force-tome-8-le-secret-de-gwen-9782266216500.html,Pascale Lecoeur,Pocket Jeunesse
17/11/2011,Muguette et ses amis de la forêt,http://www.decitre.fr/livres/muguette-et-ses-amis-de-la-foret-9782746505759.html,François Moutou,Le Pommier
17/11/2011,Mystère au Moyen Age,http://www.decitre.fr/livres/mystere-au-moyen-age-9782070642007.html,Cynthia Harnett,Gallimard jeunesse
17/11/2011,Meng et Yùn,http://www.decitre.fr/livres/meng-et-yun-9782211207942.html,Wendela Ploux de Buck,Ecole des Loisirs (L')
17/11/2011,La grotte des dinosaures Tome 14 Le choc des crocos,http://www.decitre.fr/livres/la-grotte-des-dinosaures-tome-14-le-choc-des-crocos-9782266214230.html,Rex Stone,Pocket Jeunesse
17/11/2011,La petite valise de Trotro,http://www.decitre.fr/livres/la-petite-valise-de-trotro-9782070642519.html,Bénédicte Guettier,Gallimard-Jeunesse
17/11/2011,Mademoiselle Météo,http://www.decitre.fr/livres/mademoiselle-meteo-9782211208086.html,Susie Morgenstern,Ecole des Loisirs (L')
17/11/2011,La fiancée du fantôme,http://www.decitre.fr/livres/la-fiancee-du-fantome-9782211208123.html,Malika Ferdjoukh,Ecole des Loisirs (L')
17/11/2011,Prunelle de mes yeux,http://www.decitre.fr/livres/prunelle-de-mes-yeux-9782070638123.html,Marion Muller-Colard,Gallimard-Jeunesse
17/11/2011,Une Gauloise dans le garage à vélos,http://www.decitre.fr/livres/une-gauloise-dans-le-garage-a-velos-9782070640393.html,Florence Thinard,Gallimard (Editions)
17/11/2011,Bébés chouettes,http://www.decitre.fr/livres/bebes-chouettes-9782211017718.html,"Patrick Benson, Martin Waddell",Ecole des Loisirs (L')
17/11/2011,Biboundé,http://www.decitre.fr/livres/bibounde-9782211028820.html,Michel Gay,Ecole des Loisirs (L')
17/11/2011,Sept milliards de visages,http://www.decitre.fr/livres/sept-milliards-de-visages-9782211097789.html,Peter Spier,Ecole des Loisirs (L')
17/11/2011,Haut les pattes !,http://www.decitre.fr/livres/haut-les-pattes-9782211205467.html,Catharina Valckx,Ecole des Loisirs (L')
17/11/2011,Le Noël du chat assassin,http://www.decitre.fr/livres/le-noel-du-chat-assassin-9782211206952.html,Anne Fine,Ecole des Loisirs (L')
17/11/2011,Les Chroniques de Spiderwick Tome 1 Le livre magique,http://www.decitre.fr/livres/les-chroniques-de-spiderwick-tome-1-le-livre-magique-9782266219341.html,"Tony DiTerlizzi, Holly Black",Pocket Jeunesse
17/11/2011,Les Chroniques de Spiderwick Tome 2 La lunette de Pierre,http://www.decitre.fr/livres/les-chroniques-de-spiderwick-tome-2-la-lunette-de-pierre-9782266219358.html,"Tony Di Terlizzi, Holly Black",Pocket Jeunesse
17/11/2011,Le secret des huîtres de la fine princesse Claire,http://www.decitre.fr/livres/le-secret-des-huitres-de-la-fine-princesse-claire-9782361990305.html,Olivier Fouché,Le Croît vif
17/11/2011,Mon album à compter,http://www.decitre.fr/livres/mon-album-a-compter-9782746505568.html,"Evelyne Touchard, Sébastien Chebret",Le Pommier
17/11/2011,La Cabane Magique Tome 39 les petits ramoneurs de Londres,http://www.decitre.fr/livres/la-cabane-magique-tome-39-les-petits-ramoneurs-de-londres-9782747037181.html,Mary Pope Osborne,Bayard Jeunesse
17/11/2011,Essie Et si j'étais pirate ?,http://www.decitre.fr/livres/essie-et-si-j-etais-pirate-9782747037419.html,Claire Clément,Bayard Poche
17/11/2011,Les Vampires. Comment s'en faire aimer !,http://www.decitre.fr/livres/les-vampires-9782764016626.html,Arthur Van Sdent,Québecor
17/11/2011,L'Arche part à 8 heures,http://www.decitre.fr/livres/l-arche-part-a-8-heures-9782874261503.html,"Ulrich Hub, Jörg Mühle",Alice
17/11/2011,Les Messagers de Gaïa Tome 5 La dernière cristalomancienne,http://www.decitre.fr/livres/les-messagers-de-gaia-tome-5-la-derniere-cristalomancienne-9782894354636.html,Fredrick D'Anterny,Michel Quintin
17/11/2011,Une aventure de Do Le bain déborde. Niveau 1,http://www.decitre.fr/livres/une-aventure-de-do-le-bain-deborde-9782896513888.html,Richard Houde,La Courte Echelle
17/11/2011,Super patate,http://www.decitre.fr/livres/super-patate-9788415051275.html,Artur Laperla,Bang Editions
17/11/2011,Une gauloise dans le garage à vélos,http://www.decitre.fr/livres/une-gauloise-dans-le-garage-a-velos-9782075020763.html,Florence Thinard,Gallimard (Editions)
16/11/2011,La fée Clochette Tome 12 Une idée de génie !,http://www.decitre.fr/livres/la-fee-clochette-tome-12-une-idee-de-genie-9782012024427.html,"Walt Disney, Tea Orsi",Hachette Jeunesse
16/11/2011,Le Palais de l'Oiseau Bleu. Ma jolie maison de poupées,http://www.decitre.fr/livres/le-palais-de-l-oiseau-bleu-9782013936071.html,"Orianne Lallemand, Carole Henaff",Gautier Languereau
16/11/2011,Botanique circus,http://www.decitre.fr/livres/botanique-circus-9782226231055.html,Frédéric Clément,Albin Michel (Editions)
16/11/2011,Rue de l'Articho,http://www.decitre.fr/livres/rue-de-l-articho-9782364740044.html,"Arnaud Boutin, Vincent Pianina, Nathalie Lété, Lili Scratchy",Thierry Magnier
16/11/2011,Scooby-Doo Tome 10 Gobelins à Gogo,http://www.decitre.fr/livres/scooby-doo-tome-10-gobelins-a-gogo-9782809421446.html,Marvel Panini France,Panini
16/11/2011,Inawa,http://www.decitre.fr/livres/inawa-9782914002387.html,"Mylène BDJ, Juliette Armagnac",Arphivolis
16/11/2011,Le clan des sept Tome 4 A la grange aux loups,http://www.decitre.fr/livres/le-clan-des-sept-tome-4-a-la-grange-aux-loups-9782012025783.html,Enid Blyton,Hachette Jeunesse
16/11/2011,La Bible - L'Ancien Testament Tome 1 et 2 Coffret La Genèse en 2 volumes,http://www.decitre.fr/livres/la-bible-l-ancien-testament-tome-1-et-2-coffret-la-genese-en-2-volumes-9782756029207.html,"Jean-Christophe Camus, Michel Dufranne, Damir Zitko",Delcourt
16/11/2011,Bébés chats,http://www.decitre.fr/livres/bebes-chats-9782013935630.html,Christiane Gunzi,Deux Coqs d'or (Editions)
16/11/2011,La revanche du clown,http://www.decitre.fr/livres/la-revanche-du-clown-9782364740327.html,Sara,Thierry Magnier
16/11/2011,Qui dit noir dit blanc,http://www.decitre.fr/livres/qui-dit-noir-dit-blanc-9782723485746.html,"Mario Urbanet, Antoine Guilloppé",P'tit Glénat
16/11/2011,"Histoires pour grandir en rêvant. Contes de fées, d'animaux, de sagesse du monde entier",http://www.decitre.fr/livres/histoires-pour-grandir-en-revant-9782709637824.html,Claude-Sophie Antoine,JC Lattès
16/11/2011,Pokémon,http://www.decitre.fr/livres/pokemon-9782012253599.html,Nintendo,Hachette Jeunesse
16/11/2011,Shrek. Sauve qui peut,http://www.decitre.fr/livres/shrek-9782012025820.html,DreamWorks,Hachette Jeunesse
16/11/2011,Qui Croque Quoi ?. Grandeur nature !,http://www.decitre.fr/livres/qui-croque-quoi-grandeur-nature-9782226231048.html,"Lola Schaefer, Geoff Waring",Albin Michel Jeunesse
16/11/2011,La grande panthère noire,http://www.decitre.fr/livres/la-grande-panthere-noire-9782081246652.html,"Paul François, Lucile Butel",Père Castor-Flammarion
16/11/2011,La plus mignonne des petites souris,http://www.decitre.fr/livres/la-plus-mignonne-des-petites-souris-9782081247413.html,Etienne Morel,Père Castor-Flammarion
16/11/2011,Les exploits de Quick et Flupke 2e volume,http://www.decitre.fr/livres/les-exploits-de-quick-et-flupke-2e-volume-9782203047358.html,Hergé,Casterman
16/11/2011,Oscar Pill Tome 4 L'allié des ténèbres,http://www.decitre.fr/livres/oscar-pill-tome-4-l-allie-des-tenebres-9782226231000.html,Eli Anderson,Albin Michel (Editions)
16/11/2011,Princesses,http://www.decitre.fr/livres/princesses-9782244880730.html,Cyrielle,Lito
16/11/2011,Princesse Sara Tome 4 Une petite princesse !,http://www.decitre.fr/livres/princesse-sara-tome-4-une-petite-princesse-9782302019478.html,"Audrey Alwett, Nora Moretti",Soleil Productions
16/11/2011,Les dinosaures en bande dessinée Tome 2,http://www.decitre.fr/livres/les-dinosaures-en-bande-dessinee-tome-2-9782818907917.html,"Arnaud Plumeri, Bloz",Bamboo
15/11/2011,La petite fille qui aimait les pommes de terre,http://www.decitre.fr/livres/la-petite-fille-qui-aimait-les-pommes-de-terre-9782350007977.html,Rose Lagercrantz,Oskar
15/11/2011,Les tracteurs. 100 gommettes autocollantes,http://www.decitre.fr/livres/les-tracteurs-9782244066196.html,Marc Clamens,Lito
15/11/2011,Le récit du vieil Antonio. Ou quand les indiens du Chiapas nous racontent l'indispensable diversité,http://www.decitre.fr/livres/le-recit-du-vieil-antonio-9782350008066.html,Sous-commandant Marcos,Oskar
15/11/2011,Binou et les sons,http://www.decitre.fr/livres/binou-et-les-sons-9782895125945.html,Dominique Jolin,Dominique et Compagnie
15/11/2011,Comment ça va Binou ?,http://www.decitre.fr/livres/comment-ca-va-binou-9782895125983.html,Dominique Jolin,Dominique et Compagnie
15/11/2011,Les histoires du p'tit Nikholäf,http://www.decitre.fr/livres/les-histoires-du-p-tit-nikholaf-9782917642450.html,"Charles Gabaude, Valéry Raydon",Verger des Hespérides (Le)
15/11/2011,Alice au pays des merveilles,http://www.decitre.fr/livres/alice-au-pays-des-merveilles-9782918803102.html,Lewis Carroll,Philomèle
15/11/2011,T'choupi se baigne,http://www.decitre.fr/livres/t-choupi-se-baigne-9782092020326.html,Thierry Courtin,Nathan
14/11/2011,Apocalypse. Le coffret avec 6 DVD,http://www.decitre.fr/dvd-video/apocalypse-3333290011386.html,"Daniel Costelle, Isabelle Clarke",France Télévisions Editions
14/11/2011,Les trésors des Alpes. Le jeu des 7 familles,http://www.decitre.fr/livres/les-tresors-des-alpes-9782361520748.html,La petite boîte,Petite Boite (La)
14/11/2011,Si l'Antiquité m'était contée,http://www.decitre.fr/livres/si-l-antiquite-m-etait-contee-9782917642597.html,"Gwenaëlle Le Brun, Héléna Mondier",Verger des Hespérides (Le)
11/11/2011,Les Aventures de Tintin Le trésor de Rackham le Rouge. Edition grand format,http://www.decitre.fr/livres/les-aventures-de-tintin-le-tresor-de-rackham-le-rouge-9782203051379.html,Hergé,Casterman
11/11/2011,Les Aventures de Tintin Le secret de la Licorne. Edition grand format,http://www.decitre.fr/livres/les-aventures-de-tintin-le-secret-de-la-licorne-9782203051386.html,Hergé,Casterman
